{
  "level_id": "A1",
  "version": "1.0",
  "seed": "A1-700-120x80",
  "name": "A1 â€” Ren cirkel",
  "mode": "classic_coverage",
  "goal": { "type": "coverage_at_least", "value": 0.75 },
  "rules": { "rect": { "w": 120, "h": 80, "rotation": "orthogonal" }, "grid_mm": 10, "physics": { "dt": 0.0167, "substeps": 3, "iterations": 12 } },
  "arena": { "outer_circle": { "cx": 0, "cy": 0, "r": 350 }, "inner_circles": [], "walls": [], "forbidden_polys": [] }
}